Title,Site URL
The Flu Shot Remains The Most Dangerous Vaccine | Global ...,http://www.globalresearch.ca/the-flu-shot-remains-the-most-dangerous-vaccine/5550163
Planet Paws - Over-vaccinating and the overdosing of pet...,https://www.facebook.com/PlanetPaws.ca/videos/1404799696261575/
"Yale study warns of vaccine dangers, links immunizations to brain ...",http://newstarget.com/2017-03-01-yale-study-warns-of-vaccine-dangers-links-immunizations-to-brain-disorders.html
Trump's Dangerous Support for Conspiracies About Autism and ...,http://www.newyorker.com/tech/elements/trumps-dangerous-support-for-conspiracies-about-autism-and-vaccines
Shock Video! Gov. Caught Lying About Vaccine Dangers » Alex ...,http://www.infowars.com/shock-video-gov-caught-lying-about-vaccine-dangers/
Dangers of HPV Vaccine Revealed Yet Again in Scientific Paper that ...,http://wakingtimesmedia.com/dangers-hpv-vaccine-revealed-yet-scientific-paper-retracted-now-republished/
Measles Fact Sheet for Parents | CDC,http://www.cdc.gov/vaccines/parents/diseases/child/measles.html
Five Dangerous Dog Vaccine Ingredients - Dogs Naturally Magazine,http://www.dogsnaturallymagazine.com/five-vaccine-ingredients-that-can-harm-your-dog/
Actor Robert De Niro Concerned With Dangers Of Mercury In Vaccines,http://pittsburgh.cbslocal.com/2017/02/15/actor-robert-de-niro-concerned-with-dangers-of-mercury-poisoning/
Do vaccines have dangerous side effects? | Society | The Guardian,https://www.theguardian.com/society/2003/aug/13/familyandrelationships.medicineandhealth
Johns Hopkins Scientist Exposes Flu Vaccine Danger?,http://www.snopes.com/medical/disease/flushot.asp
BOOKS ABOUT THE DANGERS OF VACCINATIONS,http://www.angelfire.com/az/sthurston/vaccination_books.html
Doctors-Scientists Warn about Dangers of Vaccination Immunisation,http://www.medicinekillsmillions.com/articles/doctors-scientists-warn-dangers-of-vaccination-immunisation.html
How the anti-vaccine movement is endangering lives - The ...,https://www.washingtonpost.com/news/wonk/wp/2014/05/05/how-the-anti-vaccine-movement-is-endangering-lives/
"CDC ""Nose"" That Live Attenuate Influenza Vaccine Is Dangerous ...",http://www.ageofautism.com/2016/10/cdc-nose-that-live-attenuate-influenza-vaccine-is-dangerous.html
Rejecting Flu Vaccine in Pregnancy | Blog | Kelly Brogan MD,http://kellybroganmd.com/rejecting-flu-vaccine-in-pregnancy/
Vaccine Dangers | Doctor Bob,http://doctorbob.com/category/vaccine-dangers/
The Dangers of Lyme Disease Vaccines for Dogs – Should You ...,http://lymediseaseguide.org/dangers-of-lyme-disease-vaccines-for-dogs
Vaccines News – Vaccines News Health Related News,http://www.vaccines.news/
Dangers of Pertussis Vaccine,http://www.newsmax.com/Health/Dr-Brownstein/pertussis-vaccines-immunity-CDC/2016/08/16/id/743837/
The Dangers of the Antivaccine Movement - TIME,"http://content.time.com/time/health/article/0,8599,2053517,00.html"
Vaccine News and Information from Dr. Joseph Mercola,http://vaccines.mercola.com/
Focus for Health | Vaccine Dangers - What Do I Do Now?,https://www.focusforhealth.org/vaccine-dangers-reactions-what-do-i-do-now/
10 Reasons Why Flu Shots Are More Dangerous Than a Flu!,http://www.bewellbuzz.com/general/10-reasons-flu-shots-dangerous-flu/
Vaccination Dangers,http://vaccinationdanger.blogspot.com/
[Book 1956] The Hidden Dangers In Polio Vaccine (Chapter 10 of ...,http://www.whale.to/a/mcbean5.html
Did Two Medical Journals Just Blacklist Gardasil Research Showing ...,http://vaccineimpact.com/2016/did-two-medical-journals-just-blacklist-gardasil-research-showing-dangers-of-the-vaccine/
Anti-Vaccine Scientific Support Arsenal – Scientific proof the media ...,https://avscientificsupportarsenal.wordpress.com/
"Vaccine Side Effects, Refuse Vaccines | Healing Our Children",http://www.healingourchildren.net/vaccine_side_effects.htm
Head Holistic MD at Cleveland Clinic Threatened By Hospital For ...,http://www.healthnutnews.com/cleveland-clinic-md-damning-article-vaccines-schedule/
"Fake news can be killed with a ""psychological vaccine"" study says ...",https://qz.com/892692/a-psychological-vaccine-could-inoculate-against-the-dangers-of-fake-news-a-new-study-found/
Flu vaccine: Ministers may have known of dangerous new strain last ...,http://www.telegraph.co.uk/news/science/science-news/11395085/Flu-vaccine-health-officials-knew-of-dangerous-new-strain-last-March.html
Why the Chickenpox Vaccine is Nuts!,http://www.compassionatesouls.com/chickenpox.html
Mild To Fatal Smallpox Vaccine Dangers - See For Yourself,http://www.rense.com/general32/see.htm
Michael Specter: The danger of science denial | TED Talk | TED.com,https://www.ted.com/talks/michael_specter_the_danger_of_science_denial
Officials Cover Up Dangers of HPV Vaccine Declares Scientist,https://globenewswire.com/news-release/2016/01/18/802684/0/en/Officials-Cover-Up-Dangers-of-HPV-Vaccine-Declares-Scientist.html
This chicken vaccine makes its virus more dangerous | PBS NewsHour,http://www.pbs.org/newshour/updates/tthis-chicken-vaccine-makes-virus-dangerous/
How dangerous is measles? | Vaccine Knowledge,http://vk.ovg.ox.ac.uk/blogs/ojohn/how-dangerous-measles
Hepatitis B Vaccine Dangers (12Mar99),http://www.vaclib.org/email/hepbdang.htm
Hepatitis A - Creating a Market for Another Superfluous Vaccine ...,http://www.thedoctorwithin.com/hepatitisa/hepatitis-a-creating-a-market-for-another-superfluous-vaccine/
Vaccine Dangers Revealed - Liveto110.com,https://liveto110.com/vaccine-dangers-revealed/
Led by the nose – New dangers of the flu vaccine | December 2016 ...,https://www.wddty.com/magazine/2016/december/led-by-the-nose-new-dangers-of-the-flu-vaccine.html
"Childhood vaccines: Tough questions, straight answers - Mayo Clinic",http://www.mayoclinic.org/healthy-lifestyle/infant-and-toddler-health/in-depth/vaccines/art-20048334
Gardasil Vaccine Even More Dangerous than Previously Thought,http://www.anh-usa.org/gardasil-vaccine-even-more-dangerous-than-previously-thought/
Jason Chaffetz Triggers Snowflakes on Vaccine Dangers,http://www.autisminvestigated.com/jason-chaffetz-snowflakes/
Vaccine Dangers in Wonderland,http://www.naturalhealthstrategies.com/vaccine-dangers.html
Cashing In On Fear: The Danger of Dr. Sears – Science-Based ...,https://sciencebasedmedicine.org/cashing-in-on-fear-the-danger-of-dr-sears/
Ask Well: What Are the Risks of Flu Vaccine? - The New York Times,https://well.blogs.nytimes.com/2015/10/16/ask-well-flu-vaccine-risks/
Trump's Dangerous Ideas About Vaccines - Bloomberg View,https://www.bloomberg.com/view/articles/2017-01-10/trump-s-dangerous-ideas-about-vaccines
Myth #5: The MMR vaccine is more dangerous because it contains ...,http://www.vox.com/cards/vaccines-facts-measles-autism-dangers/MMR-vaccine
Fears of Dangers of Chemicals in Vaccines Dispelled by Doctor ...,http://www.kgoradio.com/2017/02/17/fears-of-dangers-of-chemicals-in-vaccines-dispelled-by-doctor/
Vaccine Clinic Dangers,http://fphmapleton.com/hospital-services/wellness/vaccine-clinic-dangers.html
The Dangers Of Whooping Cough Vaccination - Prof. Gordon Stewart,http://www.vaccinationinformationnetwork.com/the-dangers-of-whooping-cough-vaccination-prof-gordon-stewart/
Vaccine Side Effects | Safety,http://www.vaccines.com/vaccine-side-effects.cfm
VRM: PCV Vaccine Exposed – Breeding Ground For ...,http://vaccineresistancemovement.org/?p=9431
Myths Fuel Dangerous Decisions to Not Vaccinate Children,http://www.livescience.com/8948-myths-fuel-dangerous-decisions-vaccinate-children.html
Chickenpox vaccine: Is it really necessary?,http://www.slate.com/articles/double_x/the_kids/2013/11/chickenpox_vaccine_is_it_really_necessary.html
"Community Immunity (""Herd Immunity"") | Vaccines.gov",https://www.vaccines.gov/basics/protection/
Herd immunity - Wikipedia,https://en.wikipedia.org/wiki/Herd_immunity
What is herd immunity? - VaccinesToday,https://www.vaccinestoday.eu/stories/what-is-herd-immunity/
Herd immunity | Vaccine Knowledge,http://vk.ovg.ox.ac.uk/herd-immunity
Herd Immunity And Measles: Why We Should Aim For 100 ...,http://www.iflscience.com/health-and-medicine/herd-immunity-and-measles-why-we-should-aim-100-vaccination-coverage/
NOVA - Official Website | What is Herd Immunity?,http://www.pbs.org/wgbh/nova/body/herd-immunity.html
How Anti-Vaccination Trends Vex Herd Immunity - WSJ,http://www.wsj.com/articles/how-anti-vaccination-trends-vex-herd-immunity-1423241871
Herd Immunity | History of Vaccines,http://www.historyofvaccines.org/content/herd-immunity-0
“Herd Immunity”: A Rough Guide | Clinical Infectious Diseases ...,http://cid.oxfordjournals.org/content/52/7/911.full
'Herd Immunity': the misplaced driver of universal vaccination ...,http://vaccinechoicecanada.com/about-vaccines/general-issues/herd-immunity/herd-immunity-the-misplaced-driver-of-universal-vaccination/
Vaccination and herd immunity: what more do we know?,https://www.ncbi.nlm.nih.gov/pubmed/22561998
Vaccines and Herd Immunity - YouTube,https://www.youtube.com/watch?v=ZuiHFg_nfnE
Public Health Myth #4: Herd Immunity Requires Vaccination,http://www.stopmandatoryvaccination.com/public-health/myth-4-herd-immunity/
Notes on Herd Immunity from Andrew Wakefield - Vaxxed,http://vaxxedthemovie.com/notes-herd-immunity-andrew-wakefield/
Vaccines Provide Herd Immunity?,https://vaccineimpact.com/2016/vaccines-provide-herd-immunity/
“Herd Immunity.” The flawed science and failures of mass ...,http://www.vaccinationcouncil.org/2012/07/05/herd-immunity-the-flawed-science-and-failures-of-mass-vaccination-suzanne-humphries-md-3/
Talking Science: Facts About Vaccines and Herd Immunity | The ...,http://www.huffingtonpost.com/natalia-reagan/the-true-facts-about-vaccines-and-herd-immunity_b_9775386.html
Data analysis activity: Herd Immunity,https://www.teachunicef.org/sites/default/files/Data_Analysis.pdf
Why a few unvaccinated children are an even bigger threat than you ...,https://www.washingtonpost.com/posteverything/wp/2015/02/03/why-a-few-unvaccinated-children-are-an-even-bigger-threat-than-you-think/
"CDC: With low vaccine rates, some areas risk losing herd immunity ...",https://www.advisory.com/daily-briefing/2014/10/21/cdc-with-low-vaccine-rates-some-areas-risk-losing-herd-immunity
Romina Libster: The power of herd immunity | TED Talk | TED.com,https://www.ted.com/talks/romina_libster_the_power_of_herd_immunity
Vaccinations prevent disease and build 'herd immunity' | Mountain ...,https://mountainx.com/living/vaccinations-prevent-disease-and-build-herd-immunity/
The Simple Math of Herd Immunity | Thoughtscapism,https://thoughtscapism.com/2015/04/20/the-simple-math-of-herd-immunity/
Opting-Out Of Vaccines; Dipping Below Herd Immunity ...,http://www.wbur.org/commonhealth/2013/08/low-state-vaccine-rates
Human Papillomavirus Prevalence and Herd Immunity after ...,https://wwwnc.cdc.gov/eid/article/22/1/15-0736
Vaccination and herd immunity to infectious diseases,http://www.nature.com/articles/318323a0
Assessment of herd immunity and cross-protection after a human ...,http://www.thelancet.com/journals/laninf/article/PIIS1473-3099(14)70841-2/abstract
"Measles vaccinations of toddlers at 89%, below 'herd immunity' level ...",http://www.cbc.ca/news/health/measles-vaccinations-of-toddlers-at-89-below-herd-immunity-level-1.3161617
News & Views - Herd Immunity and Vaccine Duration | Vaccine ...,http://media.chop.edu/data/files/pdfs/news-views-herd-immunity-nov2014.pdf
Establishing herd immunity against Ebola through vaccination,http://www.sciencedirect.com/science/article/pii/S0264410X16302018
Vaccine Glossary of Terms | CDC,http://www.cdc.gov/vaccines/terms/glossary.html
NOVA: Vaccines—Calling the Shots | Herd Immunity | Science ...,http://www.pbslearningmedia.org/resource/nvvs-sci-herdimmune/herd-immunity/
Watch how the measles outbreak spreads when kids get vaccinated ...,https://www.theguardian.com/society/ng-interactive/2015/feb/05/-sp-watch-how-measles-outbreak-spreads-when-kids-get-vaccinated
Herd immunity,https://www.washingtonparent.com/articles/0708/immunize.html
Christie is wrong. Vaccination is not a personal decision. It's a social ...,http://www.vox.com/2015/1/31/7955947/vaccination-herd-immunity
Vaccine herd immunity debunked - NaturalNews.com,http://www.naturalnews.com/050099_herd_immunity_vaccination_Russell_Blaylock.html
"WHO | Vaccination greatly reduces disease, disability, death and ...",http://www.who.int/bulletin/volumes/86/2/07-040089/en/
Low American HPV Vaccine Rates Mean Less Herd Immunity,http://www.medscape.com/viewarticle/863437
This short animation explains beautifully how herd immunity works ...,http://www.sciencealert.com/this-quick-animation-nails-how-herd-immunity-works
Chemist Gives 3 Reasons He Doesn't Vaccinate and gives vaccine ...,https://thepeopleschemist.com/reasons-dont-vaccinate-children-vaccine-supporters-shouldnt-give/
HPV Vaccinations Provides Herd Immunity,http://www.livescience.com/21487-hpv-vaccine-herd-immunity.html
Immunise - Frequently Asked Questions,http://www.immunise.health.gov.au/internet/immunise/publishing.nsf/Content/frequently-asked-questions
Vaccines and Herd Immunity,http://www.aai.org/education/Summer_Teachers/Docs/Archive/2016_Witkowski_Curriculum.pdf
Flu and herd immunity: Getting the shot is as important for the ...,http://www.cleveland.com/healthfit/index.ssf/2012/10/herd_immunity_and_the_flu_gett.html
Vaccines: Herd Immunity,http://www.ashlandchild.org/vaccine-basics/herd-immunity/
The Misunderstood Theory of Herd Immunity,http://www.thevaccinereaction.org/2015/06/the-misunderstood-theory-of-herd-immunity/
What the anti-vaxxers are getting dangerously wrong | Brookings ...,https://www.brookings.edu/blog/health360/2015/02/06/what-the-anti-vaxxers-are-getting-dangerously-wrong/
Herd Immunity: Junk Science at its Finest,http://www.thehealthyhomeeconomist.com/the-herd-immunity-myth-and-how-it-pits-parent-against-parent/
Improving MMR vaccination rates: herd immunity is a realistic goal ...,http://www.bmj.com/content/343/bmj.d5703
The Herd Immunity Theory - Treating Our Children Like Cattle,http://www.vaccineriskawareness.com/The-Herd-Immunity-Theory-Treating-Our-Children-Like-Cattle
Vaccination campaign hopes to boost herd immunity in Victoria ...,http://www.abc.net.au/news/2017-01-04/vaccination-campaign-hoped-to-boost-herd-immunity-in-victoria/8161366
The False Theory of Vaccine Derived - Herd Immunity - Vaccine Facts,http://www.vacfacts.info/the-false-theory-of-vaccine-derived---herd-immunity.html
How Vaccines Work | PublicHealth.org,http://www.publichealth.org/public-awareness/understanding-vaccines/vaccines-work/
Herd Immunity Simulator,http://www.software3d.com/Home/Vax/Immunity.php
Anti-Vaxxers Are Destroying the Herd Immunity They Rely On - The ...,http://www.thedailybeast.com/articles/2015/10/13/anti-vaxxers-are-destroying-the-herd-immunity-they-rely-on.html
Imperfect vaccines and herd immunity to HIV,https://www.semel.ucla.edu/sites/all/files/biomedicalmodeling/pdf/impvacc.pdf
JoePlummer.com | VACCINES AND HERD IMMUNITY,http://www.joeplummer.com/vaccine-and-herd-immunity
How Herd Immunity Helps Shield Those Who Can't Be Vaccinated ...,http://kut.org/post/how-herd-immunity-helps-shield-those-who-cant-be-vaccinated-diseases
Influenza Vaccination in the Face of Immune Exhaustion: Is Herd ...,https://www.hindawi.com/journals/irt/2011/419216/
5 GIFs That Show Why Herd Immunity Is So Important - BuzzFeed ...,http://www.buzzfeed.com/carolynkylstra/vaccines-and-herd-immunity
How vaccines work - Vaccinations - NHS Choices,http://www.nhs.uk/conditions/vaccinations/pages/how-vaccines-work.aspx
"How Herd Immunity Works, As Shown in a Single Incredible GIF",http://www.patheos.com/blogs/friendlyatheist/2017/02/21/how-herd-immunity-works-as-shown-in-a-single-incredible-gif/
HPV vaccine doesn't provide herd immunity or cross-protection | The ...,http://www.mdedge.com/jfponline/article/109931/vaccines/hpv-vaccine-doesnt-provide-herd-immunity-or-cross-protection
"Speaker talks Disneyland, herd immunity and vaccines | The ...",https://www.michigandaily.com/section/news/guest-speaker-talks-anti-vaxxer-movement
Herd Immunity and Vaccines - Are you protected? - Holistic Squid,http://holisticsquid.com/herd-immunity-and-vaccines-are-you-protected/
South Australia Meningococcal B Vaccine Herd Immunity Study ...,https://www.eventbrite.com.au/e/south-australia-meningococcal-b-vaccine-herd-immunity-study-tickets-29039282275
Vaccine Induced Herd Immunity for Control of Respiratory Syncytial ...,http://journals.plos.org/plosone/article?id=10.1371/journal.pone.0138018
Andrew Wakefield claims “natural Herd Immunity” is better than ...,http://scienceblogs.com/insolence/2016/05/31/andrew-wakefield-claims-natural-herd-immunity-is-better-than-anything-vaccines-can-do-never-mind-all-that-suffering/
The Myth Of Vaccine-Induced Herd Immunity | Vaccination ...,http://www.vaccinationinformationnetwork.com/the-myth-of-vaccine-induced-herd-immunity/
Vaccine opt-outs causing breaks in 'herd immunity' - latimes,http://articles.latimes.com/2011/aug/05/health/la-he-vaccines-herd-immunity-20110801
Vaccination and Herd Immunity - What is herd immunity ...,http://science.howstuffworks.com/environmental/life/cellular-microscopic/herd-immunity1.htm
Immunology 101 Series: Herd Immunity | Team Vaccine,https://teamvaccine.com/2013/05/10/immunology-101-series-herd-immunity/
Unfounded vaccine myths harm measles herd immunity | New ...,https://www.newscientist.com/article/dn26946-unfounded-vaccine-myths-harm-measles-herd-immunity/
Vaccine Herd Immunity Questions in The Hill Opinion Piece - AGE ...,http://www.ageofautism.com/2016/09/vaccine-herd-immunity-questions-in-the-hill-opinion-piece.html
Missed vaccines weaken 'herd immunity' in children - USATODAY.com,http://www.usatoday.com/news/health/2010-01-06-childhoodvaccines06_cv_n.htm
Herd immunity | definition of herd immunity by Medical dictionary,http://medical-dictionary.thefreedictionary.com/herd+immunity
Vaccines and Public Health,http://sitn.hms.harvard.edu/wp-content/uploads/2010/09/Lecture_1.2.pdf
Establishing Herd Immunity,http://animalscience.tamu.edu/wp-content/uploads/sites/14/2012/04/beef-establishing-herd-immunity.pdf
Herd Immunity – Science-Based Medicine,https://sciencebasedmedicine.org/herd-immunity/
Herd Immunity: Fact or Fiction? | Article | Kelly Brogan MD,http://kellybroganmd.com/herd-immunity-fact-fiction/
Herd Immunity vs. Viral Shedding: Who's Infecting Whom? | The ...,http://freedom-articles.toolsforfreedom.com/herd-immunity-vs-viral-shedding/
Herd Immunity and the Varicella Vaccine | JAMA Pediatrics | The ...,http://jamanetwork.com/journals/jamapediatrics/fullarticle/190491
Have You Heard About Herd Immunity? - cdc.gov,https://www.cdc.gov/careerpaths/scienceambassador/documents/herd-immunity-2013.pdf
Herd Immunity Applies to Guns as Well as Vaccinations | PJ Media,https://pjmedia.com/blog/herd-immunity-applies-to-guns-as-well-as-vaccinations/
Abstract: Vaccine Refusal and Herd Immunity for Measles (2016 ...,https://aaas.confex.com/aaas/2016/webprogram/Paper17048.html
"Just the Vax, Please: Too Many Adults Aren't Getting Immunized ...",http://www.healthmap.org/site/diseasedaily/article/just-vax-please-too-many-adults-arent-getting-immunized-and-why-we-need-them
"Vaccination: the importance of herd immunity, Pediatric Health ...",http://www.futuremedicine.com/doi/abs/10.2217/17455111.1.1.35
Conscious Consideration of Herd Immunity in Influenza Vaccination ...,http://vaccinesafetyresource.elsevier.com/sites/default/files/Flu-Parker-Conscious.pdf
How Herd Immunity Works [OC] : dataisbeautiful,https://www.reddit.com/r/dataisbeautiful/comments/5v72fw/how_herd_immunity_works_oc/
Expert Pediatrician Exposes Vaccine Myths,http://articles.mercola.com/sites/articles/archive/2009/11/14/expert-pediatrician-exposes-vaccine-myths.aspx
Rotavirus vaccination and herd immunity: an evidence-based review ...,https://www.dovepress.com/rotavirus-vaccination-and-herd-immunity-an-evidence-based-review-peer-reviewed-article-PHMT
"Is herd immunity a myth? A response to Russell Blaylock, Part 1 ...",https://skeptoid.com/blog/2014/01/10/is-herd-immunity-a-myth-a-response-to-russell-blaylock-part-1/
Role of Herd Immunity in Determining the Effect of Vaccines against ...,http://jid.oxfordjournals.org/content/191/Supplement_1/S97.long
Polio vaccine and disease: Herd immunity | Ask Dr Sears® | The ...,http://www.askdrsears.com/topics/health-concerns/vaccines/polio-vaccine-and-disease-herd-immunity
Junk Science Week: Vaccinating the 'herd' | Financial Post,http://business.financialpost.com/fp-comment/junk-science-week-vaccinating-the-herd
Herd Immunity | Informed Choice,http://pathwaystofamilywellness.org/Informed-Choice/herd-immunity.html
Herd Immunity,http://www.virology.ws/2008/05/12/herd-immunity/
Vaccine Herd Effect The Importance of Cluster-Randomized Trials to ...,https://www.fondation-merieux.org/documents/en/conference-resources/beyond-efficacy-the-full-public-health-impact-of-vaccines-in-addition-to-efficacy-measures-in-trials-2015/herd-protection-efficacy-vs-effectiveness-ann-lena-lopez.pdf
"Vaccination, Herd Immunity, Economics, and International ...",https://parasiteecology.wordpress.com/2013/07/13/herd-immunity-economics-and-international-cooperation/
Mass vaccination and herd immunity: cattle and buffalo,http://www.oie.int/doc/ged/D4029.PDF
Thimerosal in Vaccines Thimerosal | Concerns | Vaccine Safety | CDC,https://www.cdc.gov/vaccinesafety/concerns/thimerosal/
Thiomersal controversy - Wikipedia,https://en.wikipedia.org/wiki/Thiomersal_controversy
"Understanding Thimerosal, Mercury, and Vaccine Safety",https://www.cdc.gov/vaccines/hcp/patient-ed/conversations/downloads/vacsafe-thimerosal-color-office.pdf
Vaccine Safety & Availability > Thimerosal in Vaccines,http://www.fda.gov/BiologicsBloodVaccines/SafetyAvailability/VaccineSafety/UCM096228
Mercury & Vaccines - Robert F. Kennedy Jr,http://robertfkennedyjr.com/mercury-vaccines/
“Ten Lies” Told About Mercury in Vaccines,http://traceamounts.com/ten-lies-told-about-mercury-in-vaccines/
Mercury in Vaccines FAQs - NVIC,http://www.nvic.org/faqs/mercury-thimerosal.aspx
Institute for Vaccine Safety - Thimerosal Issues,http://www.vaccinesafety.edu/cc-thim.htm
Vaccine Ingredients – Thimerosal | Children's Hospital of Philadelphia,http://www.chop.edu/centers-programs/vaccine-education-center/vaccine-ingredients/thimerosal
Thimerosal in Flu Vaccine | Seasonal Influenza (Flu) | CDC,http://www.cdc.gov/flu/protect/vaccine/thimerosal.htm
"Mercury, Vaccines, and Autism",https://www.ncbi.nlm.nih.gov/pmc/articles/PMC2376879/
Mercury In Vaccines Was Replaced With Something Even MORE ...,http://articles.mercola.com/sites/articles/archive/2009/01/27/mercury-in-vaccines-was-replaced-with-something-even-more-toxic.aspx
Frequently Asked Questions about Thimerosal Thimerosal ...,http://www.cdc.gov/vaccinesafety/concerns/thimerosal/faqs.html
Mercury in Vaccines - TruthWiki,http://www.truthwiki.org/mercury-in-vaccines/
New CDC Research Debunks Agency's Assertion That Mercury in ...,http://www.ecowatch.com/cdc-mercury-vaccines-kennedy-2226257805.html
Mercury in vaccines from the Australian childhood immunization ...,https://www.ncbi.nlm.nih.gov/pubmed/20391108
"WikiLeaks, mercury in vaccines, and Hillary's email | Levi ...",https://leviquackenboss.wordpress.com/2016/10/13/wikileaks-mercury-in-vaccines-and-hillarys-email/
"Is The CDC Hiding Data About Mercury, Vaccines, And Autism?",http://www.forbes.com/sites/emilywillingham/2014/02/22/is-the-cdc-hiding-data-about-mercury-vaccines-and-autism/
CDC caught hiding data showing mercury in vaccines linked to autism,https://healthimpactnews.com/2014/cdc-caught-hiding-data-showing-mercury-in-vaccines-linked-to-autism/
Vaccines and Autism - SafeMinds Autism Environment,https://www.safeminds.org/mercury-autism/vaccines-and-autism/
What Goes Into a Vaccine? | PublicHealth.org,http://www.publichealth.org/public-awareness/understanding-vaccines/goes-vaccine/
Vaccines: Vaccinations and Mercury in Vaccines,http://www.healing-arts.org/children/vaccines/vaccines-mercury.htm
VaxTruth.org | Dr. Oz Show: Thimerosal in Flu Shots – What He Got ...,http://vaxtruth.org/2014/09/dr-oz-flu-shots/
Questions about Vaccines > Thimerosal in Vaccines Questions and ...,https://www.fda.gov/BiologicsBloodVaccines/Vaccines/QuestionsaboutVaccines/ucm070430.htm
Thimerosal and Childhood Vaccines: What You Should Know ...,http://www.health.state.mn.us/divs/idepc/immunize/hcp/thimerosalfs.html
WHO | Thiomersal and vaccines: questions and answers,http://who.int/vaccine_safety/topics/thiomersal/questions/en/
Five years of PROOF that the CDC knows vaccines still contain ...,http://www.naturalnews.com/2017-03-02-cdc-proof-five-years-vaccines-still-contain-mercury-formaldehyde-aluminum-antibiotics-and-msg-all-of-which-are-toxic-to-human-biology.html
"How Robert F. Kennedy, Jr., Distorted Vaccine Science - Scientific ...",https://www.scientificamerican.com/article/how-robert-f-kennedy-jr-distorted-vaccine-science1/
Thimerosal: What you need to know about vaccine preservative ...,http://www.cnn.com/2017/02/15/health/thimerosal-vaccine-preservative-explainer/
Thimerosal in Vaccines | Mercury in Your Environment | US EPA,https://www.epa.gov/mercury/thimerosal-vaccines
410 ILCS 51/ Mercury-Free Vaccine Act.,http://www.ilga.gov/legislation/ilcs/ilcs3.asp?ActID=2739&ChapterID=35
"Robert F. Kennedy, Jr. announces the World Mercury Project's ...",https://worldmercuryproject.org/robert-f-kennedy-jr-announces-world-mercury-projects-100000-challenge-goal-stopping-use-highly-toxic-mercury-vaccines/
Thimerosal News,http://thimerosal.news/
Thimerosal and Vaccines Q&A | IDPH,http://www.dph.illinois.gov/topics-services/prevention-wellness/immunization/thimerosal-vaccines-q-a
Thimerosal | Immunize for Good,http://www.immunizeforgood.com/fact-or-fiction/thimerosal
Hypersensitivity Reactions to Vaccine Components,http://www.medscape.com/viewarticle/516045_3
