Title,Site URL
Vaccine Safety | Vaccine Safety | CDC,https://www.cdc.gov/vaccinesafety/
Institute for Vaccine Safety -Influenza Vaccine Issues,http://www.vaccinesafety.edu/
Concerned about vaccine safety? Here are the facts - CNN.com,http://www.cnn.com/2017/01/11/health/vaccine-safety-explainer/
Safety | Vaccines.gov,https://www.vaccines.gov/basics/safety/
Talking about Vaccines: Vaccine Safety,http://www.immunize.org/safety/
WHO | Vaccine Safety Net,http://www.who.int/vaccine_safety/initiative/communication/network/vaccine_safety_websites/en/
Safety of Vaccines Used for Routine Immunization of US Children: A ...,http://pediatrics.aappublications.org/content/early/2014/06/26/peds.2014-1079
vaccine safety,https://www.washingtonpost.com/politics/trump-to-meet-with-proponent-of-debunked-tie-between-vaccines-and-autism/2017/01/10/4a5d03c0-d752-11e6-9f9f-5cdb4b7f8dd7_story.html
WHO | Global Vaccine Safety,http://www.who.int/vaccine_safety/en/
Vaccines: The real issues in vaccine safety : Nature News,http://www.nature.com/news/2011/110525/full/473436a.html
Vaccines: The real issues in vaccine safety : Nature News,http://www.nature.com/news/2011/110525/full/473436a.html
Vaccine Critic Kennedy Claims Trump Tapped Him to Chair Panel ...,https://www.scientificamerican.com/article/vaccine-critic-kennedy-set-to-chair-trump-panel-on-vaccination-safety1/
Vaccine Safety: The Facts - HealthyChildren.org,https://www.healthychildren.org/English/safety-prevention/immunizations/Pages/Vaccine-Safety-The-Facts.aspx
Influenza (Flu) Vaccine Safety | Seasonal Influenza (Flu) | CDC,http://www.cdc.gov/flu/protect/vaccine/vaccinesafety.htm
Vaccine Basics - Vaccine Safety,http://www.vaccineinformation.org/vaccine-safety/
Vaccine Safety Publications Publications | Research | Vaccine ...,http://www.cdc.gov/vaccinesafety/research/publications/index.html
Committee on Vaccine Safety,https://www.theatlantic.com/health/archive/2017/01/trump-taps-vaccine-skeptic-to-chair-committee-on-vaccine-safety/512708/
Safety Information About Specific Vaccines Vaccines | Vaccine ...,http://www.cdc.gov/vaccinesafety/vaccines/index.html
Robert F. Kennedy Jr. says a 'vaccine safety' commission is still in ...,http://www.sciencemag.org/news/2017/02/robert-f-kennedy-jr-says-vaccine-safety-commission-still-works
Vaccine Safety | Children's Hospital of Philadelphia,http://www.chop.edu/centers-programs/vaccine-education-center/vaccine-safety
Expert Q&A: Childhood Vaccine Safety,http://www.webmd.com/children/vaccines/features/childhood-vaccine-safety
Trump asks vaccine critic to chair committee on vaccine safety ...,http://arstechnica.com/science/2017/01/trump-asks-vaccine-critic-to-chair-committee-on-vaccine-safety/
Trump's proposed commission on vaccine safety alarms doctors ...,http://www.cbsnews.com/news/donald-trump-proposed-commission-on-vaccine-safety-alarms-doctors/
Vaccine Safety & Availability,https://www.fda.gov/BiologicsBloodVaccines/SafetyAvailability/vaccinesafety/default.htm
Trump asks vaccine skeptic to lead commission on vaccination safety,http://thehill.com/policy/healthcare/313572-trump-asks-vaccine-skeptic-to-lead-commission-on-vaccination-safety
RFK Jr. says Trump still wants 'vaccine safety commission' - POLITICO,http://www.politico.com/story/2017/02/robert-f-kennedy-jr-trump-vaccine-safety-commission-235058
Where Is the Vaccine Safety Grey Area?,http://www.theepochtimes.com/n3/2215622-where-is-the-vaccine-safety-grey-area/
Vaccine Safety Conference,http://www.vaccinesafetyconference.com/
Vaccine Safety Datalink - Wikipedia,https://en.wikipedia.org/wiki/Vaccine_Safety_Datalink
Parental vaccine safety concerns: results from the National ...,https://www.ncbi.nlm.nih.gov/pubmed/15710279
National Vaccine Information Center - Your Health. Your Family ...,http://www.nvic.org/
Vaccine safety: current and future challenges.,https://www.ncbi.nlm.nih.gov/pubmed/9677616
Council for Vaccine Safety,http://councilforvaccinesafety.org/
Gardasil HPV Vaccine Safety Assessed In Most Comprehensive ...,http://www.forbes.com/sites/tarahaelle/2015/07/15/gardasil-hpv-vaccine-safety-assessed-in-most-comprehensive-study-to-date/
The Facts Behind Vaccine Safety,https://www.health.ny.gov/prevention/immunization/vaccine_safety/proof.htm
Vaccine Safety and Your Child | Vaccine Education Center at CHOP,http://media.chop.edu/data/files/pdfs/vaccine-education-center-vaccine-safety-eng.pdf
Vaccine safety studies - thimerosal,https://www.aap.org/en-us/documents/immunization_vaccine_studies.pdf
Just How Safe Are Vaccines? Here Are the Numbers,http://www.livescience.com/57488-vaccine-safety-numbers.html
Vaccine Safety - AGE OF AUTISM,http://www.ageofautism.com/vaccines/
Vaccine News and Information from Dr. Joseph Mercola,http://vaccines.mercola.com/
WHO/Europe | Poliomyelitis - Vaccine safety events: managing the ...,http://www.euro.who.int/en/health-topics/communicable-diseases/poliomyelitis/publications/2013/vaccine-safety-events-managing-the-communications-response
Kennedy Challenges Journalists About Vaccine Safety,http://articles.mercola.com/sites/articles/archive/2017/02/28/kennedy-challenges-journalists-vaccine-safety.aspx
"No, We Don't Need a Bullshit Vaccine 'Safety Challenge'",http://gizmodo.com/no-we-dont-need-a-bullshit-vaccine-safety-challenge-1792411031
| Vaccine Safety Council of Minnesota,http://vaccinesafetycouncilminnesota.org/
The Politics of Vaccine Safety on Fearless Parent Radio | The ...,http://www.theamericanconservative.com/articles/the-politics-of-vaccine-safety-on-fearless-parent-radio/
Trump Asks Anti-Vaccine Activist Robert Kennedy Jr. to Lead Panel ...,https://theintercept.com/2017/01/10/trump-names-anti-vaccine-activist-robert-kennedy-jr-lead-panel-vaccine-safety/
Robert De Niro on vaccine safety: 'Something's wrong' | Fox News,http://www.foxnews.com/entertainment/2017/02/19/robert-de-niro-on-vaccine-safety-somethings-wrong.html
Vaccine Skeptic RFK Jr. Says He's Chairing Trump's 'Vaccine Safety ...,https://www.vice.com/en_us/article/vaccine-skeptic-rfk-jr-says-hes-chairing-trumps-vaccine-safety-commission-vgtrn
Vaccine critic Robert F. Kennedy Jr. says he'll chair Trump vaccine ...,https://www.statnews.com/2017/01/10/trump-vaccine-critic-robert-f-kennedy-jr/
"Physician's Warranty of Vaccine Safety I (Physician's name, degree ...",http://preventdisease.com/pdf/Warranty-of-Vaccine-Safety-English.pdf
Vaccine critic Robert F. Kennedy Jr. says he'll chair Trump vaccine ...,https://www.statnews.com/2017/01/10/trump-vaccine-critic-robert-f-kennedy-jr/
"Physician's Warranty of Vaccine Safety I (Physician's name, degree ...",http://preventdisease.com/pdf/Warranty-of-Vaccine-Safety-English.pdf
Trump Asks Critic of Vaccines to Lead Vaccine Safety Panel - The ...,https://www.nytimes.com/2017/01/10/us/politics/donald-trump-transition.html
'Vaccine Safety Commission': 50 studies the AAP failed to send ...,https://medium.com/@jbhandley/vaccine-safety-commission-50-studies-the-aap-failed-to-send-president-trump-bdc03a4ca8c9
"Kennedy, De Niro Hold Major Vaccine Safety Press Conference ...",http://www.infowars.com/kennedy-de-niro-to-hold-major-vaccine-safety-press-conference/
PA-15-312: Research to Advance Vaccine Safety (R01),https://grants.nih.gov/grants/guide/pa-files/PA-15-312.html
Trump's ideas on vaccine safety worry top autism researcher | The ...,http://www.sltrib.com/news/4812784-155/trumps-ideas-on-vaccine-safety-worry
Global vaccine safety blueprint - The landscape analysis,http://whqlibdoc.who.int/hq/2012/WHO_IVB_12.04_eng.pdf
Anti-Vaccine Activist Says Trump Asked Him to Head Commission ...,http://www.nbcnews.com/politics/politics-news/trump-meets-anti-vaccine-activist-after-raising-fringe-theory-trail-n705296
“Challenge” Over Vaccine Safety,https://www.buzzfeed.com/azeenghorayshi/kennedy-vaccine-denier-challenge
Vaccine Skeptic RFK Jr. Says Trump Asked Him To Lead Panel On ...,http://www.huffingtonpost.com/entry/trump-vaccines-autism_us_58750d8ce4b02b5f858b3810
Donald Trump asks vaccine skeptic Robert Kennedy Jr. to lead ...,http://www.denverpost.com/2017/01/10/robert-kennedy-jr-vaccine-safety-commission/
"Protestors, parents differ over vaccine safety - Story | WAGA",http://www.fox5atlanta.com/health/fox-medical-team/211651628-story
Trump asks vaccine skeptic RFK Jr. to lead study on vaccine safety,http://www.usatoday.com/story/news/politics/onpolitics/2017/01/10/donald-trump-robert-kennedy-vaccines-autism/96391920/
Vaccine safety | Supplies and Logistics | UNICEF,https://www.unicef.org/supply/index_vaccine_safety.html
Discover The Many Dangers Of Vaccines and Vaccination,http://www.stopmandatoryvaccination.com/vaccine-dangers/
Vaccine Safety Commission: 50 studies the AAP failed to send ...,http://www.naturalnews.com/2017-02-27-vaccine-safety-commission-50-studies-the-aap-failed-to-send-president-trump-2.html
Vaccine Safety: 10 Facts for Parents,http://www.immunize-utah.org/MA_course/vaccine_inf_parent.pdf
Vaccine Safety & Availability > Thimerosal in Vaccines,http://www.fda.gov/BiologicsBloodVaccines/SafetyAvailability/VaccineSafety/UCM096228
Is The HPV Vaccine Safe? v 2.0 — Information is Beautiful,http://www.informationisbeautiful.net/2011/is-the-hpv-vaccine-safe-v-2-0/
Vaccine Safety,http://www.nfid.org/about-vaccines/safety
Vienna Vaccine Safety Initiative,http://www.vi-vi.org/
Trump Meets with RFK Jr. To Discuss “Vaccine Safety” – Science ...,https://sciencebasedmedicine.org/trump-meets-with-rfk-jr-to-discuss-vaccine-safety/
"Vaccine Safety: Medical Contraindications, Myths, and Risk ...",http://pedsinreview.aappublications.org/content/36/6/227
Vaccine Safety & Big Pharma Issues - Vaxxed,http://vaxxedthemovie.com/vaccine-safety-big-pharma-issues/
Donald Trump gives vaccine skeptic Robert Kennedy Jr. chair of ...,http://www.cnbc.com/2017/01/10/donald-trump-appoints-vaccine-critic-robert-kennedy-jr-to-panel-examining-vaccine-safety.html
Vaccine Safety Resources Brochure,http://www.ecbt.org/images/articles/Vaccine_Safety_Resource.pdf
NVAC Vaccine Safety White Paper Final Report,https://www.hhs.gov/sites/default/files/nvpo/nvac/nvac_vswp.pdf
Trump asks RFK Jr. to chair vaccine safety commission - NY Daily ...,http://www.nydailynews.com/news/politics/trump-anti-vaccination-activist-robert-f-kennedy-meet-article-1.2942576
Vaccine Safety - Minnesota Dept. of Health,http://www.health.state.mn.us/divs/idepc/immunize/safety/
Vaccine Safety Manual for Concerned Families and Health ...,http://vacbook.com/vsm.htm
Donald Trump and a major medical clinic have moved vaccine anti ...,http://www.latimes.com/business/hiltzik/la-fi-hiltzik-vaccine-trump-cleveland-20170111-story.html
Anti-Vaxxer: Trump Tapped Me for Vaccine Safety Committee ...,http://nymag.com/scienceofus/2017/01/trump-taps-anti-vaxxer-to-chair-committee-on-vaccine-safety.html
Vaccine Safety,https://public.health.oregon.gov/PreventionWellness/VaccinesImmunization/VaccineSafety
Robert Deniro Anti Vaccine Safety Press Conference,http://www.refinery29.com/2017/02/141182/robert-de-niro-anti-vaccine-press-conference
Vaccine Safety: Answers to Parents' Top Questions,http://www.eziz.org/assets/docs/IMM-916.pdf
Trump taps vaccine skeptic Kennedy to launch review - AOL News,https://www.aol.com/article/news/2017/01/10/trump-taps-vaccine-skeptic-kennedy-to-launch-review/21652089/
Global Child Health: Vaccine Safety,http://downloads.aap.org/DOFA/Issue%20Brief%20-%20Vaccine%20Safety.pdf
Concerned About The Lack Of Vaccine Safety & The Autism ...,http://www.collective-evolution.com/2017/03/02/concerned-about-the-lack-of-vaccine-safety-the-autism-epidemic-heres-what-you-can-do/
Robert Kennedy Jr. says tapped by Trump to head vaccine safety ...,http://www.reuters.com/article/us-usa-trump-vaccines-idUSKBN14U2HK
Vaccine Safety,http://www.cdph.ca.gov/programs/immunize/Pages/VaccineSafety.aspx
Global Child Health: Vaccine Safety,http://downloads.aap.org/DOFA/Issue%20Brief%20-%20Vaccine%20Safety.pdf
Trump taps anti-vaxxer to lead vaccine safety committee (updated),https://www.engadget.com/2017/01/10/trump-taps-anti-vaxxer-for-vaccine-safety-committee/
Robert F. Kennedy Jr. to Chair Trump's Commission on Vaccine Safety,http://www.naturalblaze.com/2017/01/robert-f-kennedy-jr-chair-trumps-vaccine-safety-panel.html
Are vaccines safe? The answer is clear: Yes. - TODAY.com,http://www.today.com/health/are-vaccines-safe-answer-clear-yes-t106904
Trump Asks Vaccine Skeptic Robert F. Kennedy Jr. to Lead ...,http://ktla.com/2017/01/10/trump-asks-vaccine-skeptic-robert-f-kennedy-jr-to-lead-commission-on-vaccine-safety/
Trump and vaccine safety: Here's what RFK Jr. has said about autism.,https://www.bloomberg.com/news/articles/2017-01-11/trump-and-vaccine-safety-here-s-what-rfk-jr-has-said-about-autism
Vaccine Safety Bibliographies,https://vaers.hhs.gov/resources/biblio
WHO Vaccine Safety Basics: Welcome,http://vaccine-safety-training.org/
"Vaccine Safety Research, Data Access, and Public Trust | The ...",https://www.nap.edu/catalog/11234/vaccine-safety-research-data-access-and-public-trust
Vaccine Information Statement | Home | VIS | CDC,https://www.cdc.gov/vaccines/hcp/vis/
Vaccine Information You Need from the Immunization Action Coalition,http://www.vaccineinformation.org/
National Vaccine Information Center - Your Health. Your Family ...,http://www.nvic.org/
Vaccine Information Statements - VISs - CDC information sheets for ...,http://www.immunize.org/vis/
Vaccine Information Statement | Current VISs | CDC,http://www.cdc.gov/vaccines/hcp/vis/current-vis.html
Vaccine Education Center | Children's Hospital of Philadelphia,http://www.chop.edu/centers-programs/vaccine-education-center
VACCINE INFORMATION COALITION - Home,http://www.vacinfo.org/
National Vaccine Information Center - Wikipedia,https://en.wikipedia.org/wiki/National_Vaccine_Information_Center
Vaccination Information Network: Home,http://www.vaccinationinformationnetwork.com/
MDHHS - Vaccine Information Statements (VIS),"http://www.michigan.gov/mdhhs/0,5885,7-339-73971_4911_4914-138197--,00.html"
Vaccine Information Statements (VIS) | Vaccines.gov,https://www.vaccines.gov/more_info/vis/
WHO | Vaccines,http://www.who.int/topics/vaccines/en/
More Info | Vaccines.gov,https://www.vaccines.gov/more_info/
ThinkTwice Global Vaccine Institute: Avoid Vaccine Reactions,http://www.thinktwice.com/
Vaccine News and Information from Dr. Joseph Mercola,http://vaccines.mercola.com/
Parents Requesting Open Vaccine Education (PROVE),http://vaccineinfo.net/
Vaccine Information Statements & Addendums - Texas DSHS,https://www.dshs.texas.gov/immunize/literature/litlist.shtm
National Vaccine Information Center | Facebook,https://www.facebook.com/national.vaccine.information.center/
Vaccine Information Statements,https://www.aap.org/en-us/advocacy-and-policy/aap-health-initiatives/immunization/Pages/vis.aspx
NVIC Advocacy Home,http://nvicadvocacy.org/
"Information about Vaccines for Children, Adolescents, and Adults ...","https://www.ok.gov/health/Disease,_Prevention,_Preparedness/Immunizations/Information_about_Vaccines_for_Children,_Adolescents,_and_Adults/"
Important Vaccine Information Statement (VIS) Facts,https://www.michigan.gov/documents/mdch/newerVIS_1212_180697_7.pdf
Vaccine Information Statements (VIS),https://www.health.ny.gov/prevention/immunization/vms.htm
Vaccine Truth - My story,http://www.vaccinetruth.org/
VIEW-hub - IVAC - International Vaccine Access Center - Johns ...,http://www.jhsph.edu/research/centers-and-institutes/ivac/view-hub/
WebMD Vaccines Center - Adult Vaccination Information,http://www.webmd.com/vaccines/
ConnecticuT Vaccine Information Alliance,http://www.ctvia.org/
Allied Vaccine Group: All Information on Vaccines and Vaccination,http://www.vaccine.org/
HPV VACCINE: INFORMATION FOR PARENTS,http://www.state.nj.us/health/cd/documents/hpv_brochure.pdf
Vaccines,https://www.fda.gov/BiologicsBloodVaccines/Vaccines/
Travelers' Health | CDC,https://wwwnc.cdc.gov/travel/
HPV VACCINE: INFORMATION FOR PARENTS,http://www.nj.gov/health/cd/documents/hpv_vaccine_qa.pdf
VIEW-hub : Home,http://view-hub.org/
Vaccines and Immunization | Facts and Information,http://vaccines.com/
Vaccine Information Statements - Mississippi State Department of ...,"http://www.msdh.state.ms.us/msdhsite/_static/14,0,71,663.html"
Parent comprehension of polio vaccine information pamphlets.,https://www.ncbi.nlm.nih.gov/pubmed/8657518
Immunization - Influenza Vaccine Information,http://idph.iowa.gov/immtb/immunization/vaccine
Vaccine Information Resources,http://www.nfid.org/links/vaccines
Vaccine Information Statements (VIS) | Florida Department of Health,http://www.floridahealth.gov/programs-and-services/immunization/information-for-healthcare-providers/vis/index.html
CDC Vaccine Information | University of West Florida,http://uwf.edu/offices/student-health-services/immunizations/cdc-vaccine-information/
Childhood Vaccine Information and Schedules | Wisconsin ...,https://www.dhs.wisconsin.gov/immunization/childhood.htm
DHEC: Vaccinations,http://www.scdhec.gov/Health/Vaccinations/
Vaccine Information Statements,https://www.cdph.ca.gov/programs/immunize/Pages/VaccineInformationStatements.aspx
Vaccine Information Statements,http://www.dhhr.wv.gov/oeps/immunization/vis/pages/vis.aspx
ADH: Vaccine Information Sheets,http://www.healthy.arkansas.gov/programsServices/infectiousDisease/Immunizations/Pages/VaccineInformationSheets.aspx
HPV VACCINE: INFORMATION FOR PARENTS,https://www.nj.gov/health/cd/documents/hpv_brochure.pdf
Institute for Vaccine Safety - Vaccine Information Statements and ...,http://www.vaccinesafety.edu/VIS-ACIP.htm
Vaccine Information Statements - Mississippi State Department of ...,"http://msdh.ms.gov/msdhsite/_static/14,0,71,663.html"
Vaccine Information StatementsSkip to the navigation | Topic ...,https://healthy.kaiserpermanente.org/health/care/!ut/p/a0/FchBCoMwEAXQE8lftELormcQsclGpuNggskklGmLt1eX7yHghaD0SytZqkr5tOeqJmqPKJQtdqK8c65NlkSYEBDah9ZC8Fo7Jo5yHdveBH57X4j_tMB_pXfujkF0Hge0UtytzM8DnfvpoQ!!/
VIS: Vaccine Information Statements | mcir.org,https://www.mcir.org/resource/vis-vaccine-information-statements/
Vaccine Information Statements,https://adph.org/Immunization/Default.asp?id=541
Parents' Source of Vaccine Information and Impact on Vaccine ...,https://www.hindawi.com/journals/apm/2012/932741/
Virginia Immunization Information System .. [Portal Main Page],https://viis.vdh.virginia.gov/
Vaccination Information & Choice Network - Vaccine/Vaccination ...,http://www.wellwithin1.com/vaccine.htm
"Adult Vaccine Information | Whatcom County, WA - Official Website",http://www.co.whatcom.wa.us/759/Adult-Vaccine-Information
For Schools and Parents - Vaccine Requirements :: Washington ...,http://www.doh.wa.gov/CommunityandEnvironment/Schools/Immunization/VaccineRequirements
"vaccines information: history, science of over-vaccination",http://www.thedogplace.org/vaccines/
Flu Vaccination Information,https://www.ors.od.nih.gov/flu/Pages/default.aspx
"Children & Adolescent Vaccine Information | Whatcom County, WA ...",http://www.whatcomcounty.us/770/Children-Adolescent-Vaccine-Information
USCIS Vaccination Requirements,http://www.uscis.gov/portal/site/uscis/menuitem.5af9bb95919f35e66f614176543f6d1a/?vgnextoid=3384cc5222ff5210VgnVCM100000082ca60aRCRD&vgnextchannel=6abe6d26d17df110VgnVCM1000004718190aRCRD
USCIS Vaccination Requirements,http://www.uscis.gov/portal/site/uscis/menuitem.5af9bb95919f35e66f614176543f6d1a/?vgnextoid=3384cc5222ff5210VgnVCM100000082ca60aRCRD&vgnextchannel=6abe6d26d17df110VgnVCM1000004718190aRCRD
2016 Seasonal Flu Vaccination Information | University of Iowa ...,https://uihc.org/2016-seasonal-flu-vaccination-information
Dr Tenpenny - Exposing The Truth About Vaccines,http://drtenpenny.com/
Vaccine Information Statements (VIS) | Immunizations | Health ...,http://health.mo.gov/living/wellness/immunizations/vis.php
Pertussis Vaccine Information – Parents – Antelope Valley Union ...,http://www.avdistrict.org/apps/pages/index.jsp?uREC_ID=235076&type=d&pREC_ID=562053
National Vaccine Information Center – Science-Based Medicine,https://sciencebasedmedicine.org/tag/national-vaccine-information-center/
Vaccine Information – Valley Animal Center,https://valleyanimal.org/vaccine-information/
Vaccine Information Week | Natural Society,http://naturalsociety.com/vaccine-information-week/
Vaccine Information Statements,http://studenthealth.emory.edu/hs/services/allergy_immunization/vis.html
Immunization Requirement & Information ‐ Health Network ...,http://health.colostate.edu/immunization-requirement-information/
THE VACCINATION RACKET,http://www.whale.to/vaccines.html
Vaccines and autism: Antivaccination group advertising on billboards.,http://www.slate.com/blogs/bad_astronomy/2013/03/15/vaccines_and_autism_antivaccination_group_advertising_on_billboards.html
Vaccine Information for Health Care Professionals | Merck Vaccines,https://www.merckvaccines.com/Professional-Resources/Pages/ProfessionalResourcesHome
Vaccine Information Statements | Philadelphia Immunization Program,http://kids.phila.gov/index.php/resources/vaccine-information-statements/
Vaccine Information : Woodstock Pediatric Medicine,http://woodstockpeds.com/vaccine-information/
Travel Vaccines,http://www.immunize-utah.org/travel%20vaccines/index.html
New Yorkers for Vaccination Information and Choice,http://nyvic.org/nyvic/
Immunization - HPV Vaccine Information,https://idph.iowa.gov/immtb/immunization/hpv
Seasonal Flu Vaccine Information | Frederick County Health ...,http://health.frederickcountymd.gov/156/Seasonal-Flu-Vaccine-Information
Meningitis Vaccine Information | University Health Center,http://www.health.umd.edu/clinicalservices/allergimmuntravel/meningitis
Meningitis B vaccine information | GSK,http://www.gsk.com/en-gb/media/resource-centre/meningitis-b-vaccine-information/
Vaccine Information Sheets : Benzie-Leelanau District Health ...,http://www.bldhd.org/vaccine-information-sheets
Flu Vaccine Information – About Us – Carlsbad Municipal Schools,http://www.carlsbadnmschools.com/apps/pages/index.jsp?uREC_ID=261470&type=d&pREC_ID=1062929
Flu Vaccine Information,http://www.baycounty-mi.gov/health/fluvaccineinformation.aspx
Vaccine Information - Fairmount Pediatrics,http://fairmountpediatrics.com/vaccine-information/
Vaccine Information Statements – GIVE2MCV4,https://www.give2mcv4.org/essential-tools/vaccine-information-statements/
Federal Register :: Proposed Revised Vaccine Information Materials ...,https://www.federalregister.gov/documents/2016/10/18/2016-25144/proposed-revised-vaccine-information-materials-for-mmr-measles-mumps-and-rubella-and-mmrv-measles
Vaccine Information | AquaTactics,http://aquatactics.com/vaccine-information/
Influenza Vaccine Information | Texas Children's Pediatrics,https://texaschildrenspediatrics.org/influenza-vaccine-information
VACCINE INFORMATION | Laurel Pediatrics,http://www.advocarelaurelpediatrics.com/Useful-Links-(1)/VACCINE-INFORMATION.aspx
Hepatitis A Vaccination Information,https://www.tamhsc.edu/ehs/docs/hepatitis-a-vaccination.pdf
Immunization - Meningococcal Information,http://www.adph.org/Immunization/Default.asp?id=556
"Measles, Mumps, and Rubella (MMR) Vaccine Information Statement",https://shop.aap.org/Measles-Mumps-and-Rubella-MMR-Vaccine-Information-Statement
Vaccine Information Sheets,http://www.panfpc.com/vaccine-information-sheets
Vaccination Information Network - RationalWiki,http://rationalwiki.org/wiki/Vaccination_Information_Network
Hepatitis A Vaccine Information Statement,https://www.hrsa.gov/advisorycommittees/childhoodvaccines/Meetings/20151203/hepatitisavaccinestatement.pdf
Vaccine Information Statement (VIS) - TAHD,http://www.tahd.org/vaccine-information-statement-vis.html
Vaccine Information — Northeast Wisconsin Immunization Coalition,http://newimmunizationcoalition.org/new-page-4/
Vaccine Information Disclaimer | Animal Hospital of Chesterfield ...,http://www.animalhospitalofchesterfield.com/vaccine-information-disclaimer/
Vaccine Information Statement: ppsv - what you need to know,http://www.cottagehealth.org/app/files/public/90/Pneumococcal-Vaccine.pdf
Vaccine Excipient & Media Summary - Excipients Included in U.S. ...,https://www.cdc.gov/vaccines/pubs/pinkbook/downloads/appendices/b/excipient-table-2.pdf
Vaccines: Vac-Gen/Additives in Vaccines Fact Sheet,http://www.cdc.gov/vaccines/vac-gen/additives.htm
List of vaccine ingredients - Wikipedia,https://en.wikipedia.org/wiki/List_of_vaccine_ingredients
Vaccine Ingredients and Manufacturer Information - Vaccines ...,http://vaccines.procon.org/view.resource.php?resourceID=005206
Redirect CDC | Parents | Vaccine Ingredients,http://www.cdc.gov/vaccines/parents/vaccine-decision/ingredients.html
Vaccine Ingredients: What you should know | The Vaccine ...,http://media.chop.edu/data/files/pdfs/vaccine-education-center-vaccine-ingredients.pdf
VaxTruth.org | Vaccine Ingredients — A Comprehensive Guide,http://vaxtruth.org/2011/08/vaccine-ingredients/
Vaccinate Your Baby : Ingredients,http://www.vaccinateyourbaby.org/about/ingredients.cfm
Vaccine Ingredients & Side Effects » Generation Rescue | Jenny ...,http://www.generationrescue.org/resources/vaccination/vaccine-ingredients-and-side-effects/
Vaccine Ingredients Calculator: Discover the ingredients in the ...,http://www.vaccine-tlc.org/
Vaccine ingredients | Vaccine Knowledge,http://vk.ovg.ox.ac.uk/vaccine-ingredients
Vaccine Ingredients | Children's Hospital of Philadelphia,http://www.chop.edu/centers-programs/vaccine-education-center/vaccine-ingredients
What Goes Into a Vaccine? | PublicHealth.org,http://www.publichealth.org/public-awareness/understanding-vaccines/goes-vaccine/
What's in Vaccines | Vaccines.gov,https://www.vaccines.gov/basics/safety/vaccine_ingredients/
Discover the ingredients in the vaccines that your doctor recommends,http://www.vaccine-tlc.org/vic
MMR® II - Merck.com MMR® II,https://www.merck.com/product/usa/pi_circulars/m/mmr_ii/mmr_ii_pi.pdf
