Title,Site URL
Vaccines for Children Program: Vulnerabilities in Vaccine ...,https://oig.hhs.gov/oei/reports/oei-04-10-00430.pdf
healthfinder.gov - Get Your Child's Shots on Schedule,https://healthfinder.gov/HealthTopics/Category/doctor-visits/shotsvaccines/get-your-childs-shots-on-schedule
No vaccinations for children in Syria's Eastern Ghouta - Al Jazeera ...,http://www.aljazeera.com/news/middleeast/2016/02/vaccinations-children-syria-eastern-ghouta-160211081507919.html
City of Chicago :: Vaccines for Children Program (VFC),https://www.cityofchicago.org/city/en/depts/cdph/supp_info/infectious/vfc.html
Effect of the Vaccines for Children program on physician referral of ...,https://www.ncbi.nlm.nih.gov/pubmed/11483791
Tennessee Vaccines for Children Program - TN.Gov,https://tn.gov/health/article/vcf
"Since The Start Of The Vaccines For Children Program, Uptake Has ...",http://content.healthaffairs.org/content/35/2/356.abstract
Vaccine For Children Program (VFC) - Immunization Program ...,http://www.maine.gov/dhhs/mecdc/infectious-disease/immunization/vcp.shtml
Infant and Toddler Vaccine Schedule,http://www.healthline.com/health/vaccinations/infant-immunization-schedule
VFC Vaccine Order Form | Philadelphia Immunization Program,https://kids.phila.gov/index.php/documents/vfc-vaccine-order-form-2/
Vaccines for Children Program :: Washington State Department of ...,http://www.doh.wa.gov/ForPublicHealthandHealthcareProviders/PublicHealthSystemResourcesandServices/Immunization/VaccinesforChildren
Tennessee Vaccines for Children Program - kidcentraltn.com,https://www.kidcentraltn.com/program/tennessee-vaccines-for-children-program
Vaccines For Children (VFC) Program (vaccine),https://files.medi-cal.ca.gov/pubsdoco/publications/masters-mtp/part2/vaccine_m00o03o04o11.doc
Vaccines for Children,https://nmhealth.org/about/phd/idb/imp/vfc/
Vaccines for Children Program - Wikipedia,https://en.wikipedia.org/wiki/Vaccines_for_Children_Program
HPV Vaccine for Children: Gardasil and Cervarix Pros and Cons ...,http://www.webmd.com/children/vaccines/features/should-your-child-get-hpv-vaccine
Vaccines for Children Program,https://www1.nyc.gov/site/doh/providers/nyc-med-cir/vaccines-for-children-program.page
Vaccine for Children (VFC) Program - Delaware Health and Social ...,http://www.dhss.delaware.gov/dph/dpc/immunize-vfc.html
Most U.S. adults support routine MMR vaccine for children - UPI.com,http://www.upi.com/Health_News/2017/02/02/Most-US-adults-support-routine-MMR-vaccine-for-children/5251486061943/
Children's Vaccines: Research on Risks for Children from Vaccines ...,http://www.healing-arts.org/children/vaccines/
HPV Vaccines,https://www.cancer.org/cancer/cancer-causes/infectious-agents/hpv/hpv-vaccines.html
Vaccines for Children Program - Mississippi State Department of ...,"http://msdh.ms.gov/msdhsite/_static/41,0,71,184.html"
Vaccines for Children | Immunization | Division of Public Health ...,http://www.dhhs.nh.gov/dphs/immunization/vfc.html
Vaccines for Children (VFC) Program - Forms,http://dpbh.nv.gov/Programs/VFC/dta/Forms/Vaccines_for_Children_(VFC)_Program_-_Forms/
Vaccines for preventing influenza in healthy children | Cochrane,http://www.cochrane.org/CD004879/ARI_vaccines-for-preventing-influenza-in-healthy-children
Vaccine For Children (VFC),https://www.illinois.gov/hfs/MedicalProviders/ProviderPrograms/Pages/VaccineForChildren(VFC).aspx
Assistance Programs for Those Who Aren't Covered for the HPV ...,https://www.gardasil9.com/insurance-and-support/assistance-programs/
Help Children Get Immunized | Think BIG | UNICEF USA,https://www.unicefusa.org/mission/survival/immunization
Vaccine Recommendations for Infants & Children - Chapter 7 - 2016 ...,https://wwwnc.cdc.gov/travel/yellowbook/2016/international-travel-with-infants-children/vaccine-recommendations-for-infants-children
Vaccines For Children | Philadelphia Immunization Program,http://kids.phila.gov/index.php/programs/vaccines-for-children/
Recommended Immunization Schedules - HealthyChildren.org,https://www.healthychildren.org/English/safety-prevention/immunizations/Pages/Recommended-Immunization-Schedules.aspx
Infant and Child Vaccines - Vaccines You Need - When Do Infants ...,http://www.vaccineinformation.org/infants-children/schedules.asp
Vaccines for Children (Immunizations) - AAA Comprehensive ...,http://aaachc.org/vaccines-for-children-immunizations/
"Vaccines for Children (VFC) Program | Yakima County, WA",http://www.yakimacounty.us/373/Vaccines-for-Children-VFC-Program
Vaccines For Children Program- Information For Healthcare Providers,https://www.nj.gov/health/cd/documents/vfc_brochure.pdf
Vaccinations for Children and Teens | National Association of ...,https://www.napnap.org/vaccinations-children-and-teens
Nevada Vaccines for Children |,https://www.vfcnevada.org/
NJ Recovery and Reinvestment Plan | NJ Vaccines for Children ...,http://www.nj.gov/recovery/programs/vaccines.html
8 Reasons to Delay Vaccines for Kids,"http://www.health.com/health/gallery/0,,20513064,00.html"
Spokane Regional Health District | Vaccine for Children (VFC ...,https://www.srhd.org/providers/vfc.asp
Dr. Sanjay Gupta: Benefits of vaccines for children are a matter of fact,http://pix11.com/2017/01/10/dr-sanjay-gupta-benefits-of-vaccines-are-a-matter-of-fact/
907 KAR 1:680. Vaccines for Children Program.,http://www.lrc.state.ky.us/kar/907/001/680.htm
New vaccine study: Childhood vaccines are safe - CNN.com,http://www.cnn.com/2014/07/01/health/vaccines-for-kids-safe/
Kentucky: Cabinet for Health and Family Services - Health Care ...,http://chfs.ky.gov/dph/epi/health+care+professionals.htm
Benefits vs. Risks | Immunize for Good,http://www.immunizeforgood.com/fact-or-fiction/benefits-vs.-risks
Vaccine for Children,http://www.sanantonio.gov/Health/HealthServices/Immunizations/VaccineForChildren
Vaccines for Children & Adolescents,https://www.co.dakota.mn.us/HealthFamily/HealthServices/ImmunizationClinics/Pages/vaccines-for-children.aspx
Vaccines For Children Program (VFC): Utah County Health ...,http://www.utahcounty.gov/dept2/Health/Nursing/VFC.asp
Childhood Immunization | Vaccines for Children | MedlinePlus,https://medlineplus.gov/childhoodimmunization.html
Vaccines for Children (VFC) Program Update: Fee Schedule Code ...,http://www.emblemhealth.com/Providers/Claims-Corner/Coding/Vaccines-for-Children-VFC-Program-Update-Fee-Schedule-Code-Revisions.aspx
Vaccines for Children (VFC) Program,http://www.awarepoint.com/features/temperature-monitoring-system-for-the-vaccines-for-children
Five Important Reasons to Vaccinate Your Child | Vaccines.gov,https://www.vaccines.gov/more_info/features/five-important-reasons-to-vaccinate-your-child.html
Benefits vs. Risks | Immunize for Good,http://www.immunizeforgood.com/fact-or-fiction/benefits-vs.-risks
"WHO | Vaccination greatly reduces disease, disability, death and ...",http://www.who.int/bulletin/volumes/86/2/07-040089/en/
Vaccine Basics - Importance of Vaccines,http://www.vaccineinformation.org/vaccines-save-lives/
Why Vaccinate? | History of Vaccines,http://www.historyofvaccines.org/content/articles/why-vaccinate
Consumers (Biologics) > Vaccines for Children - A Guide for Parents ...,https://www.fda.gov/BiologicsBloodVaccines/ResourcesforYou/Consumers/ucm345587.htm
Vaccines ProCon.org,http://vaccines.procon.org/
Vaccines: Vac-Gen/Why Immunize?,http://www.cdc.gov/vaccines/vac-gen/why.htm
Benefits and risks of vaccination - Vaccinations - NHS Choices,http://www.nhs.uk/Conditions/vaccinations/Pages/benefits-and-risks.aspx
Key Facts About Seasonal Flu Vaccine | Seasonal Influenza (Flu ...,http://www.cdc.gov/flu/protect/keyfacts.htm
Vast Majority of Americans Say Benefits of Childhood Vaccines ...,http://www.pewinternet.org/2017/02/02/vast-majority-of-americans-say-benefits-of-childhood-vaccines-outweigh-risks/
Weighing the Risks and Benefits - HealthyChildren.org,https://www.healthychildren.org/English/safety-prevention/immunizations/Pages/Weighing-the-Risks-and-Benefits.aspx
"Adult HPV Vaccine Age, Guidelines, Side Effects, Benefits",http://www.webmd.com/vaccines/adult-hpv-vaccine-guidelines
"A Multitude of Vaccine Benefits, Yet Controversy Persists - NYTimes ...",http://www.nytimes.com/ref/health/healthguide/esn-vaccinations-ess.html
Dr. Sanjay Gupta: Benefits of vaccines are a matter of fact - CNN.com,http://www.cnn.com/2017/01/10/health/vaccines-sanjay-gupta/
Benefits from Immunization During the Vaccines for Children ...,https://www.cdc.gov/mmwr/preview/mmwrhtml/mm6316a4.htm
Vaccines: Benefits outweigh the risks | Group Health Research ...,https://www.grouphealthresearch.org/live-healthy/all-articles/live-healthy-2014/vaccines-benefits-outweigh-risks/
Benefits of Flu Vaccination,https://www.cdc.gov/flu/pdf/freeresources/nivw-flu-vaccination-benefits-2014.pdf
CDC: Vaccines save hundreds of thousands of lives,http://www.usatoday.com/story/news/nation/2014/04/24/cdc-vaccine-benefits/8094789/
Most Americans Think the Benefits of the MMR Vaccine Outweigh ...,https://blogs.scientificamerican.com/guest-blog/most-americans-think-the-benefits-of-the-mmr-vaccine-outweigh-risks/
Benefits of combination vaccines: effective vaccination on a ...,https://www.ncbi.nlm.nih.gov/pubmed/12564784
Vaccine Benefits | NIH: National Institute of Allergy and Infectious ...,https://www.niaid.nih.gov/research/vaccine-benefits
"Economic benefits of vaccines - Gavi, the Vaccine Alliance",http://www.gavi.org/library/audio-visual/presentations/economic-benefits-of-vaccines/
Review of the risks and benefits of yellow fever vaccination including ...,https://www.ncbi.nlm.nih.gov/pubmed/22551029
Benefits and risks of the Sanofi-Pasteur dengue vaccine: Modeling ...,http://science.sciencemag.org/content/353/6303/1033
Feline Vaccines: Benefits and Risks,http://www.vet.cornell.edu/fhc/health_information/vaccines.cfm
Flu Vaccine Risks and Benefits (video) | Khan Academy,https://www.khanacademy.org/partner-content/stanford-medicine/stanford-influenza/v/flu-risks-and-benefits
The benefits of vaccines and vaccination,http://www.healthforanimals.org/resources-and-events/resources/papers/128-the-benefits-of-vaccines-and-vaccination.html
Benefits of Influenza Vaccine | Flu Shot Benefits | Flublok,http://www.flublok.com/resources/benefits-of-flu-vaccine/
HPV Vaccines,https://www.cancer.org/cancer/cancer-causes/infectious-agents/hpv/hpv-vaccines.html
"Studies shed light on effects of serial flu shots, current vaccine's ...",http://www.cidrap.umn.edu/news-perspective/2017/02/studies-shed-light-effects-serial-flu-shots-current-vaccines-benefits
Flu Vaccine Has Added Benefits for People With Diabetes - The ...,https://well.blogs.nytimes.com/2016/07/27/flu-vaccine-has-added-benefits-for-people-with-diabetes/
Pet Vaccination: Risks and Benefits - Dogs Naturally Magazine,http://www.dogsnaturallymagazine.com/pet-vaccination-risks-and-benefits/
ADVANCE | IMI - Innovative Medicines Initiative,https://www.imi.europa.eu/content/advance
Get Your Flu Vaccine: Why the Benefits Outweigh the Risks | For ...,http://health.usnews.com/health-care/for-better/articles/2016-11-14/get-your-flu-vaccine-why-the-benefits-outweigh-the-risks
The Vaccine Guide: Risks and Benefits for Children and Adults ...,https://www.amazon.com/Vaccine-Guide-Benefits-Children-Adults/dp/1556434235
Benefits of partially effective HIV vaccine limited by | Cosmos,https://cosmosmagazine.com/biology/benefits-of-partially-effective-hiv-vaccine-limited-by-resistance-study-suggests
Pediatric Research | Rotavirus vaccine's benefits outweigh its risks,https://www.whyimmunize.org/rotavirus-vaccines-benefits/
You Decide: The Risks and Benefits of the MMR Vaccination ...,https://vactruth.com/2016/02/18/mmr-vaccine/
"Caution on new dengue vaccine: In some countries, harm outweighs ...",https://www.statnews.com/2016/09/01/dengue-vaccine-can-harm/
Vaccines and Immunization - Public Health,https://www.publichealth.va.gov/vaccines.asp
Majority of Americans say benefits of childhood vaccines outweigh ...,https://www.sciencedaily.com/releases/2017/02/170202122808.htm
"Just the Vax, Please: HPV Vaccination - Do the benefits outweigh ...",http://www.healthmap.org/site/diseasedaily/article/just-vax-please-hpv-vaccination-do-benefits-outweigh-risks-1614
National Vaccine Injury Compensation Program | Benefits.gov,https://www.benefits.gov/benefits/benefit-details/641
Pneumococcal Vaccine Benefits - Evaluating Lung Problems ...,http://www.healthcommunities.com/evaluating-lung-problems/pneumonia-vaccine-benefits_jhmwp.shtml
Understanding Public Perceptions of Benefits and Risks of ...,http://onlinelibrary.wiley.com/doi/10.1111/risa.12114/pdf
The pneumococcal vaccine | BabyCenter,http://www.babycenter.com/0_the-pneumococcal-vaccine_13782.bc
Delaying Vaccines Increases Risks—with No Added Benefits ...,https://www.scientificamerican.com/article/delaying-vaccines-increases-risks-with-no-added-benefits/
Economic Benefit Of Vaccines Highlighted In 2017 Bill & Melinda ...,http://healthaffairs.org/blog/2017/02/21/economic-benefit-of-vaccines-highlighted-in-2017-bill-melinda-gates-annual-letter/
3. Who benefits from vaccines? | Australian Academy of Science,https://www.science.org.au/learning/general-audience/science-booklets/science-immunisation/3-who-benefits-vaccines
"Benefits of HPV vaccine can be seen in high school girls, study says ...",http://www.latimes.com/science/sciencenow/la-sci-sn-hpv-vaccine-gardasil-works-fast-teens-20150427-story.html
International study suggests benefits of TB vaccine have been ...,http://www3.imperial.ac.uk/portal/page/portallive/C74EA8A8672D0AE3E040C69B47396524
Benefits of New Shingles Vaccine May Extend to More Patients,http://www.medscape.com/viewarticle/847488
Cost Effectiveness of Vaccines (Infographic) - IVAC - International ...,http://www.jhsph.edu/research/centers-and-institutes/ivac/resources/vaccine-cost-effectiveness.html
Vaccine Benefits,http://www.ecbt.org/index.php/facts_and_issues/article/vaccine_benefits
Vaccinations,https://www.avma.org/public/PetCare/Pages/vaccinations.aspx
Vaccine Benefits,http://www.bevaccinesmart.com/vaccine_benefits.html
HPV vaccine's benefits too great to ignore,http://hhma.org/blog/hpv-vaccines-benefits-too-great-to-ignore/
Understand the Benefits and Misconceptions of Flu Vaccines | NBC4 ...,http://www.nbcwashington.com/news/health/Dr_-Jackie-on-Benefits-and-Misconceptions-of-Flu-Vaccines_Washington-DC-396067871.html
Teacher Guides By Film - The Vaccine War | Teacher Center ...,http://www.pbs.org/wgbh/pages/frontline/teach/vaccine/
Anti-vaccine parents to stop receiving childcare benefits under ...,https://www.rt.com/news/323142-parents-childcare-benefits-australia/
Vaccine safety-vaccine benefits:science and the public's perception ...,http://www.nature.com/nri/journal/v1/n2/full/nri1101-160a.html
A Look at Each Vaccine: Haemophilus Influenzae Type B (Hib ...,http://www.chop.edu/centers-programs/vaccine-education-center/vaccine-details/haemophilus-influenzae-type-b-hib-vaccine
BBC - Future - Vaccines: Risks and benefits,http://www.bbc.com/future/story/20120523-vaccines-the-numbers
"HPV vaccine: Who needs it, how it works - Mayo Clinic",http://www.mayoclinic.org/diseases-conditions/hpv-infection/in-depth/hpv-vaccine/art-20047292
"The HPV Vaccine: Background, Coverage & Benefits",http://www.amchp.org/programsandtopics/AdolescentHealth/resources/Documents/adolescent-health-HPV.pdf
"Valuing Influenza Vaccine: Medical, Economic, and Social Benefits ...",http://cid.oxfordjournals.org/content/48/3/299.full
An unexpected benefit of inactivated poliovirus vaccine,http://www.virology.ws/2015/01/06/an-unexpected-benefit-of-inactivated-poliovirus-vaccine/
Flu vaccine benefits,http://preventingtheflu.org/dwnld/pdfs/Flu%20vaccine%20benefits.pdf
The global value of vaccination,https://www.uvm.edu/~bwilcke/ehreth.pdf
The benefits of the measles vaccine go beyond measles ...,http://scienceblogs.com/insolence/2015/05/15/the-benefits-of-the-measles-vaccine-go-beyond-measles/
The critical public-health benefits of the HPV vaccine - The ...,https://www.washingtonpost.com/opinions/the-critical-public-health-benefits-of-the-hpv-vaccine/2016/06/22/2cfbdb44-3720-11e6-8f7c-d4c723a2becb_story.html
European Strategy for Influenza A/H1N1 Vaccine Benefit-Risk ...,http://www.ema.europa.eu/docs/en_GB/document_library/Report/2010/01/WC500044933.pdf
Why the Benefits of the Flu Vaccine Far Outweigh the Risks,https://health.clevelandclinic.org/2016/11/benefits-flu-vaccine-far-outweigh-risk/
The Dengue Vaccine Dilemma: Balancing the Individual and ...,http://journals.plos.org/plosmedicine/article?id=10.1371/journal.pmed.1002182
Long-Term Benefits of Shingles Vaccine (Zostavax) Now in Question ...,https://www.peoplespharmacy.com/2014/08/21/long-term-benefits-of-shingles-vaccine-zostavax-now-in-question/
The benefits of influenza vaccine in pregnancy for the fetus and the ...,http://www.ncbi.nlm.nih.gov/pubmed/25414589
The Benefits of Hepatitis B Vaccine Far Outweigh the Risks: A ...,http://www.immunize.org/reports/report024.asp
Universal flu vaccines could offer key benefits over seasonal shots ...,https://sciencelife.uchospitals.edu/2017/01/05/universal-flu-vaccines-could-offer-key-benefits-over-seasonal-shots/
A Cost-Benefit Analysis of Vaccines - The Atlantic,https://www.theatlantic.com/health/archive/2012/01/a-cost-benefit-analysis-of-vaccines/251565/
"Safer, with more benefits: parents' vaccine views shifting | Michigan ...",http://www.uofmhealth.org/news/archive/201507/vaccine-views
Alternative influenza vaccine may provide clinical benefits and cost ...,http://www.news-medical.net/news/20170125/Alternative-influenza-vaccine-may-provide-clinical-benefits-and-cost-savings-study-suggests.aspx
High-Dose Flu Vaccine Benefits - AgingCare.com,https://www.agingcare.com/articles/high-dose-flu-vaccine-143030.htm
Economic benefits from HPV vaccine should be shared with poorer ...,http://www.lshtm.ac.uk/newsevents/news/2016/economic_benefits_from_hpv_vaccine_should_be_shared.html
"The science is clear: Vaccines are safe, effective, and do not cause ...",http://hub.jhu.edu/2017/01/11/vaccines-autism-public-health-expert/
National HPV vaccination program would provide big benefits | Ars ...,https://arstechnica.com/science/2016/04/national-hpv-vaccination-program-would-provide-big-benefits/
Booster shots: The accidental advantages of vaccines | New Scientist,https://www.newscientist.com/article/dn24027-booster-shots-the-accidental-advantages-of-vaccines/
Nanopatch Technology - Benefits - Needle-free Vaccine Delivery,http://www.vaxxas.com/nanopatch-technology/benefits
The benefits of influenza vaccine in pregnancy for the fetus and the ...,http://www.cps.ca/en/documents/position/influenza-vaccine-in-pregnancy
The benefits of redesigning Benin's vaccine supply chain,http://www.sciencedirect.com/science/article/pii/S0264410X14006410
Value of post-licensure data on benefits and risks of vaccination to ...,http://vaccinesafetyresource.elsevier.com/sites/default/files/Parashar-Value-Vac.pdf
Parents of young children are more 'vaccine hesitant' | Pew ...,http://www.pewresearch.org/fact-tank/2017/02/06/parents-of-young-children-are-more-vaccine-hesitant/
Flu Vaccine Provides Substantial Benefits for Patients With Diabetes ...,http://www.mdedge.com/fedprac/article/119904/vaccines/flu-vaccine-provides-substantial-benefits-patients-diabetes
HPV vaccine may benefit HIV-infected women | National Institutes of ...,https://www.nih.gov/news-events/news-releases/hpv-vaccine-may-benefit-hiv-infected-women
Study indicates E. coli vaccine benefits broilers at high risk for infection,http://poultryhealthtoday.com/study-indicates-e-coli-vaccine-benefits-broilers-at-high-risk-for-infection/
Dr. Sanjay Gupta: Benefits of vaccines for children are a matter of fact,http://pix11.com/2017/01/10/dr-sanjay-gupta-benefits-of-vaccines-are-a-matter-of-fact/
Why don't we talk about how the HPV vaccine can prevent anal ...,http://www.slate.com/blogs/outward/2016/11/30/why_don_t_we_talk_about_how_the_hpv_vaccine_can_prevent_anal_cancers.html
Immunization and vaccines - Canada.ca,https://www.canada.ca/en/public-health/topics/immunization-vaccines.html
MODULE 1 – Balancing efficacy and safety - WHO Vaccine Safety ...,http://vaccine-safety-training.org/balancing-efficacy-and-safety.html
The role of a hepatitis C virus vaccine: modelling the benefits ...,http://bmcmedicine.biomedcentral.com/articles/10.1186/s12916-015-0440-2
Discover The Many Dangers Of Vaccines and Vaccination,http://www.stopmandatoryvaccination.com/vaccine-dangers/
Fact or Fiction?: Vaccines Are Dangerous - Scientific American,https://www.scientificamerican.com/article/fact-or-fiction-vaccines-are-dangerous/
Vaccine Dangers (from http://educate-yourself.org),http://educate-yourself.org/vcd/
Vaccine dangers: The facts don't lie - NaturalNews.com,http://www.naturalnews.com/045267_Mary_Tocco_vaccines_side_effects.html
Vaccine Dangers | Natural Health 365,http://www.naturalhealth365.com/category/vaccine-dangers/
U.S. Government Says Vaccines are Dangerous,http://articles.mercola.com/sites/articles/archive/2011/09/27/vaccines-are-dangerous-says-the-government.aspx
The Dangers of Vaccine Denial - The New York Times,https://www.nytimes.com/2015/02/08/opinion/sunday/nicholas-kristof-the-dangers-of-vaccine-denial.html
12 myths and facts about vaccines | Fox News,http://www.foxnews.com/health/2013/08/17/12myths-and-facts-about-vaccines.html
How Pharmaceutical Companies Hide the Dangers of Vaccines from ...,https://vactruth.com/2013/09/26/how-pharmaceutical-hide-dangers/
Vaccinations? Know the risks and failures - Diseases and Vaccines ...,http://www.nvic.org/vaccines-and-diseases/Vaccinations--Know-the-risks-and-failures-.aspx
Six Reasons to Say NO to Vaccination - The Healthy Home Economist,http://www.thehealthyhomeeconomist.com/six-reasons-to-say-no-to-vaccination/
American College of Pediatricians Latest to Warn of Gardasil HPV ...,https://vaccineimpact.com/2016/american-college-of-pediatricians-latest-to-warn-of-hpv-vaccine-dangers/
"Objective, science-based analysis of vaccine dangers ...",http://vaccinepapers.org/about/
Vaccine Myths Debunked | PublicHealth.org,http://www.publichealth.org/public-awareness/understanding-vaccines/vaccine-myths-debunked/
Shock Video! Gov. Caught Lying About Vaccine Dangers - YouTube,https://www.youtube.com/watch?v=k9XRbjOQDvY
ThinkTwice Global Vaccine Institute: Multiple Vaccines. Danger!,http://www.thinktwice.com/multiple.htm
"Vaccines, Autism, and the Danger of the Anti-Vaccination Movement ...",http://www.berkeleywellness.com/healthy-community/contagious-disease/article/danger-anti-vaccine-movement
'Crimes against humanity' for concealing HPV-vaccine dangers,http://mobile.wnd.com/2016/01/crimes-against-humanity-for-concealing-hpv-vaccine-dangers/
The Brilliance of Dr. Suzanne Humphries on The Dangers of Vaccines,https://www.youtube.com/watch?v=McfXd_Xuojs
"Dr. Sherri Tenpenny Discloses Dire Vaccine Dangers, An Interview ...",http://www.geoengineeringwatch.org/dr-sherri-tenpenny-discloses-dire-vaccine-dangers-an-interview-with-dane-wigington/
10 Dangerous Beliefs About Childhood Vaccination ...,http://www.cosmopolitan.com/health-fitness/a57222/top-childhood-vaccine-misconceptions/
Robert F Kennedy To Expose 'CDC Cover-Up' Of Vaccine Dangers,http://yournewswire.com/robert-kennedy-cdc-vaccine-dangers/
Vaccine Dangers/ Visions of the Future - Shows,http://www.coasttocoastam.com/show/2015/12/02
The MMR Vaccine – A Comprehensive Overview of the Potential ...,http://www.organiclifestylemagazine.com/issue/17-the-mmr-vaccine-a-comprehensive-overview-of-the-potential-dangers-and-effectiveness
Trump's vaccine-commission idea is biased and dangerous : Nature ...,http://www.nature.com/news/trump-s-vaccine-commission-idea-is-biased-and-dangerous-1.21310
Officials Cover Up Dangers of HPV Vaccine - The Weston A. Price ...,https://www.westonaprice.org/press/officials-cover-up-dangers-of-hpv-vaccine/
Vaccine Dangers,http://www.wellwithin1.com/vaccine.htm
Dangers of vaccine refusal near the herd immunity threshold: a ...,https://www.ncbi.nlm.nih.gov/pubmed/25981883
"Study Reveals ""Unavoidable"" Danger of HPV Vaccines ...",http://www.greenmedinfo.com/blog/study-reveals-unavoidable-danger-hpv-vaccines
Autism Relevant Vaccine Dangers,http://www.uni.edu/desoto/autism_relevant_vaccine_dangers.htm
WHO | What are some of the myths – and facts – about vaccination?,http://www.who.int/features/qa/84/en/
The Anthrax Vaccine is Dangerous,http://www.naturodoc.com/library/public_health/anthrax_vaccine.htm
Vaccine Dangers Books,http://immunizationalternatives.com/vaccines-dangers-books/
Parents | Making the Vaccine Decision | CDC,https://www.cdc.gov/vaccines/parents/vaccine-decision/
Vaccinosis: Health Hazards of Scheduled Animal and Pet Vaccines,http://www.shirleys-wellness-cafe.com/AnimalWellness/Petvacc
The Most Dangerous Vaccine - CBS News,http://www.cbsnews.com/news/the-most-dangerous-vaccine/
100 Compiled Studies on Vaccine Dangers,http://www.activistpost.com/2011/09/100-compiled-studies-on-vaccine-dangers.html
Vaccine Dangers and Vested Interests,https://www.nexusmagazine.com/articles/doc_view/33-vaccine-dangers-and-vested-interests
More Dangerous Than Measles - LewRockwell,https://www.lewrockwell.com/2015/02/donald-w-miller-jr-md/more-dangerous-than-measles/
"6 Dangerous Anti-Vaccination Arguments Analyzed, Explained, And ...",http://www.huffingtonpost.com/2015/02/05/anti-vaccine-arguments-analyzed-explained_n_6607026.html
What are the Dangers of the MMR Vaccine?,http://www.globalhealingcenter.com/natural-health/what-are-the-dangers-of-the-mmr-vaccine/
Pet Vaccine Dangers and Recommendations,http://healthypets.mercola.com/sites/healthypets/archive/2010/03/31/high-cost-of-pet-vaccinations.aspx
Benefits vs. Risks | Immunize for Good,http://www.immunizeforgood.com/fact-or-fiction/benefits-vs.-risks
